id,old_title,old_slug,old_category,action,new_title,new_slug,new_category,seo_description,duplicate_of
760ccad5-5ac4-4408-849c-5b62afb5ceb5,Breaking Generational Cycles,unprocessed-grief-anxiety-next-generation,Relationships & Communication,RETITLE,How Unprocessed Grief Passes Anxiety Through Generations,how-unprocessed-grief-passes-anxiety-through-generations,Anxiety & Stress,"When grief goes unprocessed in one generation, it can transform into anxiety, hypervigilance, and emotional patterns that children and grandchildren carry unknowingly.",
76a6c329-ee5f-43f4-8a0e-fb06fa581898,How to Apologize in a Way That Actually Repairs,earned-secure-attachment-how-healing-happens-through-new-relationships,Relationships & Communication,RETITLE,Earned Secure Attachment How Healing Changes Early Patterns,earned-secure-attachment-how-healing-changes-early-patterns,Relationships & Social Health,"Earned secure attachment shows that insecure childhood patterns are not permanent — through therapy and new relationships, people can build trust and closeness.",
76cf0c87-3b28-44d9-ba5f-74dd4bff9393,Longevity and Mental Health,senior-centers-community-programs-social-connection,"Aging, Dementia & Late-Life Mental Health",RETITLE,Senior Centers and Social Connection for Older Adults,senior-centers-and-social-connection-for-older-adults,Life Transitions & Crises,"Senior centers offer meals, exercise, and community programs that combat depression and isolation in older adults, often at low or no cost.",
7709351c-483c-48a0-8091-6d63f8dabe36,The Model Minority Myth,mental-health-middle-eastern-cultures,"Cultural Perspectives, Inclusion & Global Wellness",RETITLE,Mental Health in Middle Eastern Cultures Honor and Faith,mental-health-in-middle-eastern-cultures-honor-and-faith,Global & Cultural Mental Health,"In Middle Eastern communities, concepts of family honor, collective identity, and Islamic faith shape how mental health is understood and whether help is sought.",
7722c338-a632-4753-8415-ea4cd20e9d45,Reclaiming Your Sense of Self After Loss,masks-we-wear-code-switching-people-pleasing-losing-yourself,"Self-Worth, Confidence & Identity",RETITLE,Code-Switching and People-Pleasing When Masking Erodes Identity,code-switching-and-people-pleasing-when-masking-erodes-identity,Self-Esteem & Identity,"Chronic code-switching and people-pleasing can erode a sense of self, contributing to anxiety, burnout, and identity confusion over time.",
782bd619-3eec-49cc-a5d5-8bb3df87ba47,Big T and Small t Trauma,how-trauma-changes-brain-neuroscience,Trauma-Informed Education & Healing,RETITLE,How Trauma Changes the Brain Amygdala Hippocampus and More,how-trauma-changes-the-brain-amygdala-hippocampus-and-more,Trauma & PTSD,"Neuroscience research shows trauma causes measurable changes in the amygdala, hippocampus, and prefrontal cortex, explaining why PTSD symptoms occur.",
78310a35-d26c-42a8-95a6-8349b56ff1cd,The Psychology of Attraction,friendship-breakups-hurt-romantic,Relationships & Communication,RETITLE,Why Friendship Breakups Hurt as Much as Romantic Ones,why-friendship-breakups-hurt-as-much-as-romantic-ones,Relationships & Social Health,"Friendship dissolution activates the same neural pain pathways as physical injury, yet society provides few rituals or validation for grieving these losses.",
7849e1f5-2f07-45c4-b70b-b9c7be0b6441,Depression and Spirituality,cbt-for-depression-how-it-works,"Depression, Grief & Loss",RETITLE,How CBT for Depression Works and What to Expect,how-cbt-for-depression-works-and-what-to-expect,Therapy & Treatment,"Cognitive-behavioral therapy is among the most researched treatments for depression, teaching people to identify distorted thinking patterns and develop balanced perspectives.",
7870a77b-439f-47cc-a9cb-2abc51525031,Pain Management in Older Adults,making-friends-after-65-social-connection-strategies,"Aging, Dementia & Late-Life Mental Health",RETITLE,Making Friends After 65 Strategies for Social Connection,making-friends-after-65-strategies-for-social-connection,Life Transitions & Crises,Retirement removes the proximity and shared context that make friendship easy — practical strategies help older adults build meaningful social connections.,
7942f76e-9c0c-4ffc-aacd-27b958f2dd26,How to Quiet the Inner Critic,why-positive-affirmations-dont-work-science,"Self-Worth, Confidence & Identity",RETITLE,Why Positive Affirmations Backfire for Low Self-Esteem,why-positive-affirmations-backfire-for-low-self-esteem,Self-Esteem & Identity,Research shows positive affirmations can worsen mood in people with low self-esteem due to cognitive dissonance — and evidence-based alternatives work better.,
7944b063-0a26-4dd2-a0d4-8d10b92eb9c5,Grief When a Parent Dies,helping-children-manage-big-emotions-emotion-coaching,Relationships & Communication,RETITLE,Emotion Coaching Helping Children Manage Big Feelings,emotion-coaching-helping-children-manage-big-feelings,Children & Adolescents,"Gottman's emotion coaching approach treats children's emotional moments as teaching opportunities, building lifelong regulation skills through validation and labeling.",
794bbd27-aa66-4ff1-a6b7-0b994448b90e,Parenting a Child With Anxiety,how-bullying-in-childhood-creates-lasting-psychological-patterns,Relationships & Communication,RETITLE,How Childhood Bullying Creates Lasting Psychological Patterns,how-childhood-bullying-creates-lasting-psychological-patterns,Children & Adolescents,"Being bullied in childhood significantly raises the risk of anxiety, depression, and social difficulties that can persist well into adulthood.",
7b8d97ff-d14f-402d-be7a-f2a7b7f9772f,Anxious Attachment,exposure-therapy-for-phobias-how-facing-fear-rewires-the-brain,"Anxiety, Stress & Overwhelm",RETITLE,Exposure Therapy for Phobias How Facing Fear Rewires the Brain,exposure-therapy-for-phobias-how-facing-fear-rewires-the-brain,Therapy & Treatment,"Exposure therapy systematically confronts feared objects and situations in a controlled way, achieving success rates over 80% for specific phobias.",
7b923fc9-3312-4b44-b759-de34472d4efd,What Identity Actually Means,how-perfectionism-fuels-imposter-syndrome,"Self-Worth, Confidence & Identity",RETITLE,How Perfectionism Fuels Imposter Syndrome,how-perfectionism-fuels-imposter-syndrome,Self-Esteem & Identity,"Perfectionism is one of the strongest predictors of imposter syndrome, creating a feedback loop where no amount of achievement feels like enough.",
7b9c0b60-9695-4928-b64f-2778a1c8dca9,Mindfulness Across Cultures,language-of-stigma-words-shape-attitudes,"Cultural Perspectives, Inclusion & Global Wellness",RETITLE,How Stigmatizing Language Shapes Attitudes Toward Mental Illness,how-stigmatizing-language-shapes-attitudes-toward-mental-illness,Global & Cultural Mental Health,Casual misuse of mental health terms trivializes real conditions and reinforces stigma — the words we choose actively construct public attitudes.,
7bf2dcd4-e60f-4333-ab60-fa269e419464,Trauma and Addiction,emdr-explained-eye-movements-process-traumatic-memories,Trauma-Informed Education & Healing,RETITLE,EMDR Explained How Eye Movements Process Traumatic Memories,emdr-explained-how-eye-movements-process-traumatic-memories,Trauma & PTSD,"EMDR uses bilateral stimulation to help the brain reprocess stuck traumatic memories, and is recognized by the WHO as a first-line PTSD treatment.",
7c17660a-d93e-4d43-866e-307f9d02b468,The Relationship Between Self-Worth and Success,stop-comparing-yourself-to-others,"Self-Worth, Confidence & Identity",RETITLE,How Social Comparison Harms Wellbeing and How to Stop,how-social-comparison-harms-wellbeing-and-how-to-stop,Self-Esteem & Identity,"Chronic upward social comparison, especially on social media, erodes self-esteem and raises depression risk — evidence-based strategies can break the cycle.",
7caae5aa-4afc-47ad-96f9-fc067f4ac497,Forgiveness,psychology-of-heartbreak-why-breakups-hurt,Relationships & Communication,RETITLE,The Neuroscience of Heartbreak Why Breakups Hurt So Much,the-neuroscience-of-heartbreak-why-breakups-hurt-so-much,Relationships & Social Health,"The brain processes romantic rejection using the same pain pathways as physical injury, triggering neurochemical withdrawal symptoms similar to addiction.",
7cada7ac-9a33-4b7a-b4a1-a6ef81201ffa,Anxiety and Menopause,building-your-anxiety-management-plan-a-personalized-approach,"Anxiety, Stress & Overwhelm",RETITLE,Building a Personalized Anxiety Management Plan,building-a-personalized-anxiety-management-plan,Anxiety & Stress,"A written, personalized anxiety management plan identifies triggers, in-the-moment coping tools, and daily prevention habits for when the rational mind goes offline.",
7cde8c97-f22c-4544-bddd-b8bf7994e08e,Caring for Someone With Dementia,caring-for-the-caregiver-professional-support-and-resources,"Aging, Dementia & Late-Life Mental Health",RETITLE,Professional Support Services for Family Caregivers,professional-support-services-for-family-caregivers,Life Transitions & Crises,"Respite care, adult day programs, and in-home services are essential infrastructure for family caregivers to prevent burnout, depression, and health decline.",
7cfbeae8-bd13-416c-bcc1-7dd13ef7c439,Career Anxiety,going-back-to-school-managing-stress-career-reinvention,"Work, Productivity & Burnout",RETITLE,Going Back to School as an Adult Managing Stress and Identity,going-back-to-school-as-an-adult-managing-stress-and-identity,Workplace & Academic,"Adult learners returning to school face unique stressors including role overload, financial sacrifice, and age-related imposter syndrome alongside academic demands.",
7def0f0c-c58d-4d80-9028-b478c4f58cd7,Religion and Mental Health,medical-gaslighting-when-doctors-dismiss-your-symptoms,"Chronic Illness, Pain & Medical Psychology",RETITLE,Medical Gaslighting When Doctors Dismiss Physical Symptoms,medical-gaslighting-when-doctors-dismiss-physical-symptoms,Life Transitions & Crises,Medical gaslighting — having legitimate symptoms dismissed or reclassified as psychological — affects 67% of people with chronic illness and has real psychological consequences.,
7e02be06-6ea1-4818-8c80-979e4636ddad,Racial Trauma,hyperarousal-living-in-constant-alert,Trauma-Informed Education & Healing,RETITLE,Hyperarousal Living With a Nervous System Stuck on Alert,hyperarousal-living-with-a-nervous-system-stuck-on-alert,Trauma & PTSD,Hyperarousal is a core PTSD symptom driven by a dysregulated sympathetic nervous system that keeps the body scanning for danger long after trauma ends.,
7e20e4db-5d77-43fa-8d7e-1b1a206589db,Viral Moments and Mental Health,future-technology-mental-health-ai-vr-whats-coming,"Digital Life, Social Media & Modern Stressors",RETITLE,AI and VR in Mental Health Care What the Future Holds,ai-and-vr-in-mental-health-care-what-the-future-holds,Therapy & Treatment,"From AI chatbots detecting depression early to VR exposure therapy, emerging technologies are transforming how mental health care is delivered and accessed.",
7e8b73e8-6ecf-4016-9614-bca868a4a9a6,Burnout vs Depression,dual-income-families-balancing-careers,"Work, Productivity & Burnout",RETITLE,Work-Life Stress in Dual-Income Families and the Mental Load,work-life-stress-in-dual-income-families-and-the-mental-load,Workplace & Academic,"Dual-income couples face unique work-life challenges, especially the invisible mental load of planning and organizing that often falls on one partner.",
7e9e0f2e-c866-4d87-a205-996e5a1eee53,Gratitude Practices,support-groups-for-chronic-illness-in-person-and-online-communities,"Chronic Illness, Pain & Medical Psychology",RETITLE,How Peer Support Groups Help People with Chronic Illness,peer-support-groups-chronic-illness,Life Transitions & Crises,Peer support groups offer chronic illness patients shared understanding and measurable mental health benefits — learn what makes them effective and how to find the right one.,
7eaae831-a5b7-44ee-8895-db0b054d7306,Why Self-Criticism Doesn't Work,achievement-self-worth-why-success-doesnt-fix,"Self-Worth, Confidence & Identity",RETITLE,Why Achievement Cannot Build Lasting Self-Worth,why-achievement-cannot-build-lasting-self-worth,Self-Esteem & Identity,Success provides only a temporary mood boost due to hedonic adaptation — discover why basing self-worth on accomplishments creates a fragile and unsustainable sense of self.,
7f319f10-bd0f-4337-b237-991b4ceee514,Job Insecurity,sabbaticals-career-breaks-real-time-off,"Work, Productivity & Burnout",RETITLE,Sabbaticals and Career Breaks for Recovering from Burnout,sabbaticals-career-breaks-recovering-from-burnout,Workplace & Academic,"Short vacations rarely reverse severe burnout — learn when extended leave is necessary, what options exist, and how to navigate the decision with professional support.",
7f621a38-b380-4921-8fec-8f5517c2fc14,The Dark Night of the Soul,complex-regional-pain-syndrome-when-pain-becomes-neurological,"Chronic Illness, Pain & Medical Psychology",RETITLE,Complex Regional Pain Syndrome and Its Neurological Roots,complex-regional-pain-syndrome-neurological-roots,Life Transitions & Crises,"CRPS is a chronic pain condition that develops after minor injury, causing disproportionate and persistent pain — explore the neuroscience, causes, and impact on mental health.",
7f804fdc-f859-42f3-884e-4317e92e2d72,Couples Therapy,side-effects-psychiatric-medication-what-to-expect-when-to-speak-up,"Therapy, Treatment & Mental Health Navigation",RETITLE,Managing Psychiatric Medication Side Effects Safely,managing-psychiatric-medication-side-effects,Therapy & Treatment,"Many psychiatric medication side effects are temporary or manageable — learn which to expect, which fade over time, and which require contacting a doctor immediately.",
806e0f9d-53c4-41ce-8100-1351441f1355,Depression and Anger,light-vitamin-d-mental-health-science-hype,"Depression, Grief & Loss",RETITLE,Light Exposure and Vitamin D Effects on Mood and Mental Health,light-exposure-vitamin-d-effects-on-mood-mental-health,Depression & Mood,Sunlight and vitamin D influence mood through separate biological pathways — this article separates established science from oversimplification in mental health claims.,
80b7c54d-de18-4175-87df-0dce6e97c8e1,How to Disconnect From Work,mid-career-crisis-when-path-no-longer-feels-like-yours,"Work, Productivity & Burnout",RETITLE,Navigating a Mid-Career Crisis and Loss of Professional Meaning,navigating-mid-career-crisis-loss-of-professional-meaning,Workplace & Academic,"Career satisfaction often dips in the 40s and 50s — explore the signs of mid-career crisis, why achievement stops feeling meaningful, and how to find a path forward.",
80bd5034-bc5f-45a2-a847-f7600ce22fea,Confidence After Failure,confidence-vs-arrogance,"Self-Worth, Confidence & Identity",RETITLE,Confidence vs Arrogance Understanding the Key Differences,confidence-vs-arrogance-understanding-the-key-differences,Self-Esteem & Identity,Confidence and arrogance look similar but come from opposite places — learn the psychological distinctions between secure and defensive self-esteem and the Dunning-Kruger effect.,
80e54821-f114-4221-81d9-4b3e8a22b38b,Children and Screens,building-healthy-information-diet-practical-strategies,"Digital Life, Social Media & Modern Stressors",RETITLE,Building a Healthy Information Diet to Protect Mental Wellbeing,building-healthy-information-diet-mental-wellbeing,Anxiety & Stress,Intentionally curating the news and media consumed each day reduces anxiety and overwhelm — learn step-by-step strategies for building a healthier information diet.,
80e70403-3c55-482d-8bdf-7f300426068c,Alzheimer's Disease,why-late-life-mental-health-is-often-overlooked-and-undertreated,"Aging, Dementia & Late-Life Mental Health",RETITLE,Why Mental Health in Older Adults Is Underdiagnosed and Undertreated,mental-health-older-adults-underdiagnosed-undertreated,Global & Cultural Mental Health,Ageism and atypical symptom presentation cause mental illness in older adults to be chronically missed — explore systemic barriers and how to improve detection and care.,
8128defa-6855-4537-8e01-6ee417960e54,Technology and Cognitive Aging,faith-communities-spiritual-connection-mental-health,"Aging, Dementia & Late-Life Mental Health",RETITLE,How Faith Communities Reduce Loneliness in Older Adults,faith-communities-reduce-loneliness-older-adults,Relationships & Social Health,"Religious and spiritual communities provide social connection, purpose, and ritual that buffer older adults against loneliness, depression, and declining wellbeing.",
812b3d60-033d-4e4a-bd54-7d7f1787fa69,Blended Families,the-identified-patient-when-one-person-carries-the-familys-pain,Relationships & Communication,RETITLE,The Identified Patient How Family Systems Express Dysfunction,identified-patient-family-systems-dysfunction,Relationships & Social Health,"In dysfunctional families, one member often bears visible symptoms that mask systemic issues — understanding the identified patient concept is essential for effective family therapy.",
8156124f-d62b-466f-8689-928a89bc9eb1,Nature and Trauma Healing,trauma-informed-education-schools-support-affected-students,Trauma-Informed Education & Healing,RETITLE,Trauma-Informed Education How Schools Support Affected Students,trauma-informed-education-schools-support-students,Children & Adolescents,Nearly half of US children have experienced adverse childhood events — trauma-informed schools shift from punishment to support and show measurable gains in attendance and behavior.,
815aa972-288c-492a-b048-d432fc07d14c,When Loneliness Becomes Chronic,art-of-reaching-out-making-first-move,"Loneliness, Social Connection & Belonging",RETITLE,Overcoming the Fear of Reaching Out and Making the First Move,overcoming-fear-of-reaching-out-first-move,Relationships & Social Health,The liking gap shows people consistently underestimate how much others want to hear from them — learn why reaching out first is easier and more appreciated than expected.,
8172f7d3-bd98-4e79-bd5b-697ec00a5a0b,Technology and Older Adult Loneliness,loneliness-in-caregivers-isolated-by-demands-looking-after-someone,"Loneliness, Social Connection & Belonging",RETITLE,Loneliness and Isolation Among Family Caregivers,loneliness-isolation-family-caregivers,Relationships & Social Health,Family caregivers report some of the highest loneliness rates of any group — explore why caregiving creates profound isolation and how caregivers can find connection and support.,
81ab4d33-7d20-4248-93e1-64ec6e245546,Loneliness and Purpose,when-to-let-friendship-go-recognizing-connection-run-course,"Loneliness, Social Connection & Belonging",RETITLE,Recognizing When a Friendship Has Run Its Course,recognizing-when-friendship-has-run-its-course,Relationships & Social Health,Most friendships are time-limited and situational — learn the signs that a friendship has naturally ended and how to let go with grace rather than guilt.,
81be11c8-dfca-4fb8-8821-1691152cee7a,The Examined Death,integrated-care-models-when-mental-health-and-medical-treatment-work-together,"Chronic Illness, Pain & Medical Psychology",RETITLE,Integrated Care Models Bringing Mental and Physical Health Together,integrated-care-models-mental-physical-health,Therapy & Treatment,Most chronic illness patients receive no mental health treatment due to fragmented care — integrated care models place behavioral health directly inside medical settings to close the gap.,
82188a69-a1e6-4649-8b6b-597eb4262228,Forgiveness,mindfulness-based-pain-management-what-the-evidence-shows,"Chronic Illness, Pain & Medical Psychology",RETITLE,Mindfulness-Based Stress Reduction for Chronic Pain Management,mindfulness-based-stress-reduction-chronic-pain,Therapy & Treatment,MBSR changes how the brain processes pain rather than eliminating it — four decades of research confirm it produces meaningful reductions in chronic pain intensity and psychological distress.,
826d5218-e5b9-4d84-9e64-a9d7ea22e10b,Anxiety and Loneliness,the-5-4-3-2-1-grounding-technique-how-sensory-focus-calms-anxiety,"Anxiety, Stress & Overwhelm",RETITLE,The 5-4-3-2-1 Grounding Technique for Interrupting Anxiety,5-4-3-2-1-grounding-technique-anxiety,Anxiety & Stress,"The 5-4-3-2-1 sensory grounding technique anchors attention to the present moment, interrupting panic attacks, anxiety spirals, and dissociation in just a few minutes.",
82943474-c6bb-45ad-8da8-8002f1c37f63,The Stigma of Depression,medication-for-depression-ssris-snris,"Depression, Grief & Loss",RETITLE,Antidepressant Medications How SSRIs and SNRIs Work,antidepressant-medications-ssris-snris-how-they-work,Therapy & Treatment,"Antidepressants are widely prescribed but often misunderstood — learn how SSRIs, SNRIs, and other drug classes work, what side effects to expect, and how to find the right fit.",
82b1faf5-1a7f-41ed-873a-a46aa0020f61,The Loneliness of Leadership,finding-your-tribe-shared-interests-values-search-connection,"Loneliness, Social Connection & Belonging",RETITLE,Finding Community Through Shared Interests and Values,finding-community-shared-interests-and-values,Relationships & Social Health,The strongest connections form around shared interests and values — discover strategies for identifying communities where genuine belonging is most likely to develop.,
82f38de9-1325-4c9e-8d09-4c5f763c826a,Anxiety and Jealousy,animal-phobias-why-some-fears-feel-hardwired,"Anxiety, Stress & Overwhelm",RETITLE,Animal Phobias and Why Certain Fears Feel Hardwired,animal-phobias-evolutionary-preparedness-hardwired-fears,Anxiety & Stress,"Phobias of spiders, snakes, and other animals develop rapidly because evolution prepared human brains to fear ancient threats — learn the science of prepared learning and treatment.",
830d2d95-3ddb-4cde-984d-71598eaac4e4,Social Media and Body Image,how-much-screen-time-is-too-much-evidence,"Digital Life, Social Media & Modern Stressors",RETITLE,How Much Screen Time Is Too Much According to Research,how-much-screen-time-is-too-much-research,Anxiety & Stress,"Screen time correlates with mental health problems, but the relationship depends on content type, timing, and age — review what evidence-based guidelines actually recommend.",
832fef9a-e68f-410e-b77d-df5e98a10e4e,The Neuroscience of Anxiety,normal-worry-vs-anxiety-disorder,"Anxiety, Stress & Overwhelm",RETITLE,Normal Worry vs Anxiety Disorder How to Tell the Difference,normal-worry-vs-anxiety-disorder-how-to-tell,Anxiety & Stress,"Normal worry is proportionate and time-limited, while anxiety disorders are persistent and impairing — learn the key distinctions that signal when professional help is needed.",
8333bf1d-901f-4385-a93e-a5cc1a94eba0,Alcohol Use Disorder,osdd,Understanding Mental Health Conditions,RETITLE,Other Specified Dissociative Disorder Overview and Treatment,other-specified-dissociative-disorder-overview-treatment,Trauma & PTSD,"OSDD captures dissociative presentations close to DID but with differences in amnesia or identity distinctness — learn about OSDD-1 subtypes, prevalence, and phase-oriented treatment.",
8335417d-54c0-42f6-b82d-108f6096b9f7,Digital Communication,mindful-social-media-use-strategies,"Digital Life, Social Media & Modern Stressors",RETITLE,Mindful Social Media Use to Protect Mental Health,mindful-social-media-use-to-protect-mental-health,Anxiety & Stress,"Learn how intentional, boundaried social media habits reduce depression and anxiety while preserving the benefits of online connection.",
833ea8da-f7e7-43a0-8d35-84644987170c,Depression After Mania,depression-older-adults-mistaken-for-aging,"Depression, Grief & Loss",RETITLE,Depression in Older Adults Is Underdiagnosed and Undertreated,depression-in-older-adults-underdiagnosed-and-undertreated,Depression & Mood,"Depression is not a normal part of aging, yet it is routinely missed in older adults due to ageist assumptions and atypical symptom presentation.",
8387900e-f533-471f-bab6-28c64d6b51d2,Dementia and Dignity,choosing-a-nursing-home-or-assisted-living-facility-what-to-look-for,"Aging, Dementia & Late-Life Mental Health",RETITLE,How to Evaluate Nursing Homes and Assisted Living Facilities,how-to-evaluate-nursing-homes-and-assisted-living-facilities,Life Transitions & Crises,"A practical framework for comparing care facilities using Medicare inspection reports, star ratings, and on-site visits to find quality care.",
846671d2-5bd2-4e14-b44d-e16acc973a20,The Habit of Kindness,the-compound-effect-small-daily-actions-create-extraordinary-results,"Habits, Motivation & Behavior Change",RETITLE,How Small Daily Improvements Compound Into Lasting Change,how-small-daily-improvements-compound-into-lasting-change,Workplace & Academic,The mathematics of 1% daily improvement reveals why small consistent actions produce extraordinary long-term results through exponential compounding.,
848c5baa-5f6c-4cd2-9b14-5776c28b895b,Partial Hospitalization and Intensive Outpatient,community-mental-health-centers-free-low-cost-treatment-options,"Therapy, Treatment & Mental Health Navigation",RETITLE,Community Mental Health Centers Offer Free and Low-Cost Care,community-mental-health-centers-free-and-low-cost-care,Therapy & Treatment,Community mental health centers provide sliding-scale therapy and psychiatric services regardless of insurance status or ability to pay.,
84ca08c6-c2d5-4933-badc-4e7ec8ef814c,Dissociative Disorders,advances-trauma-treatment,Understanding Mental Health Conditions,RETITLE,Emerging PTSD Treatments Beyond Traditional Therapy,emerging-ptsd-treatments-beyond-traditional-therapy,Trauma & PTSD,"MDMA-assisted therapy, stellate ganglion block, neurofeedback, and VR exposure are expanding options for treatment-resistant PTSD.",
