id,old_title,old_slug,old_category,action,new_title,new_slug,new_category,seo_description,duplicate_of
bdd22186-73d4-463e-a7fd-fe5c0a0d9e95,Music and the Spirit,hiv-aids-and-mental-health-stigma-treatment-and-thriving,"Chronic Illness, Pain & Medical Psychology",RETITLE,"HIV, Stigma, and Mental Health — Depression, Anxiety, and PTSD",hiv-stigma-and-mental-health-depression-anxiety-ptsd,Therapy & Treatment,"People living with HIV face depression, anxiety, and PTSD at far higher rates than the general population, driven by stigma and neuroinflammation.",
be271a80-c6b1-4f57-b70a-4a0e2fc7d14c,The Science of Focus,toxic-work-environments-mental-health,"Work, Productivity & Burnout",RETITLE,How Toxic Work Environments Harm Mental Health,how-toxic-work-environments-harm-mental-health,Workplace & Academic,"Toxic workplaces cause measurable psychological harm including depression, anxiety, burnout, and PTSD symptoms through chronic exposure to hostility.",
be82ded4-f2ad-41dd-991c-f7fa78f37461,Workaholism,adhd-work-performance-accommodations-help,"Work, Productivity & Burnout",RETITLE,ADHD and Work Performance — Challenges and Accommodations,adhd-and-work-performance-challenges-and-accommodations,Neurodevelopmental,"ADHD affects task initiation, time management, and organization at work — targeted accommodations can dramatically improve professional functioning.",
beb97cdf-b1b3-4a17-be9a-dc5f761ca2c3,Depression in Men,depression-across-cultures-expression,"Depression, Grief & Loss",RETITLE,How Depression Looks Different Across Cultures Worldwide,how-depression-looks-different-across-cultures-worldwide,Global & Cultural Mental Health,"Depression exists in every culture, but its expression varies — from emotional symptoms in the West to somatic complaints and spiritual crisis elsewhere.",
bef8efb0-3edb-4dbc-8460-2a94dbe766d5,When Someone Doesn't Respect Your Limits,digital-boundaries-managing-availability-social-media-screen-time,Relationships & Communication,RETITLE,Setting Digital Boundaries Around Screen Time and Availability,setting-digital-boundaries-around-screen-time-and-availability,Anxiety & Stress,"Learn how to set digital boundaries around work emails, social media, and screen time to reduce anxiety, burnout, and relationship strain.",
befa4e72-e9d8-4387-8d00-d30cfc252ec5,Living With Radical Self-Acceptance,recovery-from-perfectionism,"Self-Worth, Confidence & Identity",RETITLE,What Recovery from Perfectionism Actually Looks Like,what-recovery-from-perfectionism-actually-looks-like,Self-Esteem & Identity,Recovery from perfectionism means reduced anxiety and better relationships — not lowered standards but decoupling worth from flawless performance.,
bf521045-2449-4817-8d0e-ab0d31bcd2f6,Trauma Triggers,secondary-trauma-exposure-to-others-pain,Trauma-Informed Education & Healing,RETITLE,Secondary Trauma — When Helping Others Leaves Its Own Wounds,secondary-trauma-when-helping-others-leaves-its-own-wounds,Trauma & PTSD,"Therapists, nurses, and caregivers can develop real trauma symptoms from indirect exposure to others' pain — this is called secondary traumatic stress.",
bf64e138-907f-443a-8776-edb9cfd67963,Gender and Financial Stress,digital-mental-health-tools-for-men-apps-and-platforms-that-engage-male-users,Men's Mental Health,RETITLE,Digital Mental Health Apps and Tools That Engage Men,digital-mental-health-apps-and-tools-that-engage-men,Therapy & Treatment,"Men prefer self-directed digital mental health tools over face-to-face therapy — this article examines which apps work, why they work, and their limits.",
bf720367-54cb-4914-bb57-a511e960b54d,Depression Across the Lifespan,depersonalization-derealization,Understanding Mental Health Conditions,RETITLE,Understanding Depersonalization and Derealization Disorder,understanding-depersonalization-and-derealization-disorder,Anxiety & Stress,Depersonalization and derealization involve feeling detached from oneself or surroundings; CBT and grounding techniques are effective first-line treatments.,
bfc6c4d0-0b75-4834-adeb-9464b9bf0aac,Tourette Syndrome,neurodevelopmental-mental-health,Understanding Mental Health Conditions,RETITLE,"ADHD, Autism, and the High Rates of Co-occurring Mental Health Conditions",adhd-autism-and-co-occurring-mental-health-conditions,Neurodevelopmental,Up to 70% of people with ADHD have at least one comorbid psychiatric condition; integrated care addressing all conditions produces the best outcomes.,
c023d2d2-24f5-4adb-b447-b476076567bb,Positive Masculinity,mens-sheds-community-workshops-as-mental-health-intervention,Men's Mental Health,RETITLE,Men's Sheds — How Community Workshops Support Mental Health,mens-sheds-how-community-workshops-support-mental-health,Relationships & Social Health,"Men's Sheds are community workshops where men build social connections and purpose, producing measurable improvements in mental health and wellbeing.",
c041357d-e956-48f0-b21a-4597e61f3e1e,Post-Traumatic Growth,central-sensitization-when-your-nervous-system-amplifies-pain,"Chronic Illness, Pain & Medical Psychology",RETITLE,Central Sensitization — When the Nervous System Amplifies Pain,central-sensitization-when-the-nervous-system-amplifies-pain,Anxiety & Stress,"Central sensitization is a neurological process where the brain and spinal cord become hypersensitive, generating and amplifying chronic pain signals.",
c0854f07-29d2-4866-97a7-d1948d015ef4,Remote Work and Mental Health,tech-industry-burnout-innovation-exploitation,"Work, Productivity & Burnout",RETITLE,Tech Industry Burnout — When Innovation Culture Becomes Exploitation,tech-industry-burnout-when-innovation-culture-becomes-exploitation,Workplace & Academic,"Tech workers burn out despite high salaries and perks because hustle culture glorifies overwork, creating systemic psychological harm across the industry.",
c087afde-db46-4ff7-be0d-27ab70dbdd6a,Single Parenting,can-a-family-system-change-how-therapy-works-with-the-whole-unit,Relationships & Communication,RETITLE,How Family Systems Therapy Works With the Whole Family Unit,how-family-systems-therapy-works-with-the-whole-family-unit,Therapy & Treatment,"Family therapy treats the entire family system rather than individuals, addressing invisible patterns that drive behavioral and mental health issues.",
c0fab4d3-ea4d-41fa-a6ce-778f56461c0c,Family Roles,when-your-childs-mental-health-affects-your-own,Relationships & Communication,RETITLE,When a Child's Mental Illness Affects Parents' Own Wellbeing,when-a-childs-mental-illness-affects-parents-own-wellbeing,Children & Adolescents,"Parents of children with mental illness face higher rates of depression, anxiety, and caregiver burden — self-care is essential for sustainable caregiving.",
c1003980-dbcf-4576-a041-419b6e8f5ce1,The Psychology of Loneliness,coparenting-after-breakup-childrens-mental-health-first,Relationships & Communication,RETITLE,Co-Parenting After a Breakup — Protecting Children's Mental Health,co-parenting-after-a-breakup-protecting-childrens-mental-health,Children & Adolescents,Research shows it is parental conflict — not separation itself — that harms children; low-conflict co-parenting protects their mental health and development.,
c10116b7-4551-4244-8591-ccb682220146,End-of-Life and Meaning,chronic-respiratory-disease-and-anxiety-when-breathing-becomes-frightening,"Chronic Illness, Pain & Medical Psychology",RETITLE,Chronic Respiratory Disease and Anxiety — The Breathlessness Cycle,chronic-respiratory-disease-and-anxiety-the-breathlessness-cycle,Anxiety & Stress,"Anxiety affects up to 50% of people with severe COPD — breathlessness and fear share neural circuits, creating a cycle that requires treating both conditions.",
c15ee2e6-2a07-44f6-8347-28159819eced,Redefining Success,remote-team-dynamics-building-trust-without-physical-presence,"Work, Productivity & Burnout",RETITLE,Building Trust in Remote Teams Without Physical Presence,building-trust-in-remote-teams-without-physical-presence,Workplace & Academic,"Remote teams can match in-person performance, but building trust requires deliberate strategies to replace the organic micro-interactions of co-location.",
c1a91a4c-2e79-4cfb-887b-d0d67e7d15f3,The Meaning of Suffering,the-financial-toxicity-of-chronic-illness-when-healthcare-costs-destroy-wellbeing,"Chronic Illness, Pain & Medical Psychology",RETITLE,Financial Toxicity of Chronic Illness — When Healthcare Costs Destroy Wellbeing,financial-toxicity-of-chronic-illness-when-healthcare-costs-destroy-wellbeing,Life Transitions & Crises,"Financial toxicity describes the measurable psychological harm caused by chronic illness healthcare costs, affecting an estimated 137 million Americans.",
c1f642b0-1747-475f-befe-f7cef639f7af,Creativity at Work,remote-work-relationships-affects-partner-family,"Work, Productivity & Burnout",RETITLE,How Remote Work Affects Couples and Household Relationships,how-remote-work-affects-couples-and-household-relationships,Relationships & Social Health,"Working from home changes household dynamics for couples — research shows relationship quality depends on intentional navigation of space, time, and expectations.",
c29758ab-462f-4cb1-a586-0fd5c2065251,How to Repair the Parent-Child Relationship,cultural-trauma-historical-oppression-affects-families,Relationships & Communication,RETITLE,Cultural Trauma — How Historical Oppression Echoes Through Generations,cultural-trauma-how-historical-oppression-echoes-through-generations,Trauma & PTSD,"Slavery, genocide, and colonization create collective trauma that passes down through families via narratives, parenting practices, and ongoing discrimination.",
c2d07f7f-982d-4cb6-86ec-e98a4f7d52ab,Attachment and Anxiety,communicating-across-different-emotional-languages,Relationships & Communication,RETITLE,Communicating Across Different Emotional Processing Styles,communicating-across-different-emotional-processing-styles,Relationships & Social Health,People differ in how they express and process emotions — understanding these styles prevents misreading a partner's silence or intensity as indifference.,
c37cb2a6-d0f1-4a77-974b-8b1dccd222d7,Stigma Around Mental Health,collectivist-vs-individualist-cultures,"Cultural Perspectives, Inclusion & Global Wellness",RETITLE,Collectivist vs Individualist Cultures and Mental Health Approaches,collectivist-vs-individualist-cultures-and-mental-health-approaches,Global & Cultural Mental Health,"Individualist and collectivist cultural values fundamentally shape how mental health develops, how symptoms appear, and what recovery looks like worldwide.",
c3e3704a-2787-49ce-8c0f-95676527a91c,The Pressure to Start a Family,caregiver-burnout-aging-parent-mental-health,Relationships & Communication,RETITLE,Caregiver Burnout When Caring for an Aging Parent,caregiver-burnout-when-caring-for-an-aging-parent,Life Transitions & Crises,"Caregiver burnout from caring for aging parents causes depression, health decline, and exhaustion — learn to recognize the signs and find recovery strategies.",
c4161597-2dfd-43a1-bd19-818663a4b29e,The Psychology of Sacred Texts,navigating-disability-benefits-the-mental-health-impact-of-the-application-process,"Chronic Illness, Pain & Medical Psychology",RETITLE,How the Disability Benefits Process Harms Mental Health,how-the-disability-benefits-process-harms-mental-health,Life Transitions & Crises,The disability benefits application process worsens anxiety and depression in applicants — understand the psychological toll and how to protect your wellbeing.,
c496d01c-12bf-45f6-b3ba-2cb9ed5f09cf,The Shadow,the-role-of-palliative-psychology-in-non-terminal-chronic-conditions,"Chronic Illness, Pain & Medical Psychology",RETITLE,Palliative Psychology for People with Chronic Illness,palliative-psychology-for-people-with-chronic-illness,Therapy & Treatment,Palliative psychology addresses the grief and suffering of people living with non-terminal chronic conditions who are often left without psychological support.,
c49bbcb8-eb3e-4763-88af-0f28e37f5849,Anxiety in the Body,the-12-stages-of-burnout-recognizing-the-progression-before-its-too-late,"Anxiety, Stress & Overwhelm",RETITLE,The 12 Stages of Burnout and How to Catch Them Early,the-12-stages-of-burnout-and-how-to-catch-them-early,Workplace & Academic,Burnout progresses through 12 recognizable stages from enthusiasm to collapse — learn to identify each stage early so recovery is faster and less disruptive.,
c50f10ab-a102-4a39-a5ca-5cce7cb9c4bd,The Power of Pausing Before You Respond,when-two-insecure-attachment-styles-meet-anxious-avoidant-trap,Relationships & Communication,RETITLE,The Anxious-Avoidant Attachment Trap in Relationships,the-anxious-avoidant-attachment-trap-in-relationships,Relationships & Social Health,Anxious and avoidant attachment styles attract each other but create painful push-pull dynamics — understand why this trap forms and how couples can break free.,
c54dfa01-ba7c-4e2c-9b3b-fd134bcf0d90,Mental Health in the Global South,how-to-be-mental-health-ally,"Cultural Perspectives, Inclusion & Global Wellness",RETITLE,How to Be a Mental Health Ally in Practice,how-to-be-a-mental-health-ally-in-practice,Relationships & Social Health,Being a mental health ally means more than good intentions — learn the specific actions that genuinely support people with mental health conditions and reduce stigma.,
c585a85c-d58d-41ad-a565-c2cad6fcf279,The Medical Model vs Biopsychosocial Model,social-anxiety-disorder-when-fear-of-judgment-becomes-disabling,Understanding Mental Health Conditions,RETITLE,Social Anxiety Disorder When Fear of Judgment Becomes Disabling,social-anxiety-disorder-when-fear-of-judgment-becomes-disabling,Anxiety & Stress,"Social anxiety disorder is an intense, persistent fear of judgment in social situations that causes avoidance and significantly limits daily life and relationships.",
c594d3aa-6e8f-4a0d-8002-7162d2c183da,Boys and Mental Health,men-and-grief-cultural-permission-to-mourn,Men's Mental Health,RETITLE,Men and Grief When Culture Denies Permission to Mourn,men-and-grief-when-culture-denies-permission-to-mourn,Life Transitions & Crises,"Men grieve as deeply as women but cultural expectations limit their expression and support, leading to invisible grief and significantly worse health outcomes.",
c5c3ffa6-e5e7-4e4b-8681-d394c3bba8c0,Trans Mental Health,erectile-dysfunction-and-mental-health-the-mind-body-connection,Men's Mental Health,RETITLE,Erectile Dysfunction and Its Deep Connection to Mental Health,erectile-dysfunction-and-its-deep-connection-to-mental-health,Anxiety & Stress,"Erectile dysfunction is frequently psychological in origin, linked to performance anxiety, depression, and relationship stress rather than purely physical causes.",
c5f54ed3-973b-41f3-9c92-31170de993c1,Gender and Aging,the-role-of-humor-in-mens-mental-health-when-laughter-helps-and-when-it-hides,Men's Mental Health,RETITLE,When Humor Heals and When It Masks Pain in Men,when-humor-heals-and-when-it-masks-pain-in-men,Self-Esteem & Identity,"Humor is central to how many men bond and cope, but research shows it can either heal or conceal psychological distress depending on the style and function.",
c62428f8-4d96-4c5f-812f-d5f414add99b,Gender and Trauma,men-and-volunteering-the-mental-health-benefits-of-service,Men's Mental Health,RETITLE,How Volunteering Supports Mental Health in Men,how-volunteering-supports-mental-health-in-men,Relationships & Social Health,"Volunteering provides men with purpose, structured social connection, and a sense of competence that combats depression and isolation without requiring emotional disclosure.",
c66d6b7b-dd3f-4252-8764-136b3886fbb8,Communication and Dementia,advance-directives-and-end-of-life-care-decisions-for-older-adults,"Aging, Dementia & Late-Life Mental Health",RETITLE,Advance Directives and End-of-Life Care Decisions,advance-directives-and-end-of-life-care-decisions,Life Transitions & Crises,Advance directives like living wills and healthcare proxies allow people to specify their medical wishes in advance and spare families from agonizing decisions in a crisis.,
c6b5d8bf-3da8-46b9-8b09-a1ab33b02158,Anorexia Nervosa,living-well-with-mood-disorder-long-term-management-strategies,Understanding Mental Health Conditions,RETITLE,Living Well with a Mood Disorder Long-Term Management,living-well-with-a-mood-disorder-long-term-management,Depression & Mood,"People with mood disorders can achieve remission and quality of life through medication adherence, mood tracking, sleep hygiene, therapy, and strong social support.",
c7b49c8f-876e-4d32-a5dc-b54652ce93b6,How Shame Differs From Guilt,gender-self-esteem-societal-expectations,"Self-Worth, Confidence & Identity",RETITLE,How Gender Shapes Self-Esteem Through Societal Expectations,how-gender-shapes-self-esteem-through-societal-expectations,Self-Esteem & Identity,"Research shows gender socialization — not biology — creates measurable differences in self-esteem, particularly during adolescence, driven by appearance pressure and cultural messages.",
c8a23d26-212e-4485-b633-f28bcc78015d,Secure Base and Safe Haven,breaking-the-cycle-stop-repeating-parents-patterns,Relationships & Communication,RETITLE,Breaking the Cycle of Dysfunctional Family Patterns,breaking-the-cycle-of-dysfunctional-family-patterns,Relationships & Social Health,"Many people unconsciously repeat the dysfunctional communication, coping, and parenting patterns they grew up with — but cycle-breaking is possible with awareness and support.",
c8aef226-cc3f-4401-9723-e029e01c7c5b,What Is a Mental Health Condition,generalized-anxiety-disorder-living-with-chronic-worry,Understanding Mental Health Conditions,RETITLE,Generalized Anxiety Disorder Living with Chronic Worry,generalized-anxiety-disorder-living-with-chronic-worry,Anxiety & Stress,"Generalized anxiety disorder involves persistent, excessive worry about everyday situations lasting six months or more that interferes significantly with daily functioning.",
c91724d1-5205-4335-9796-f9a071706424,Sacred Masculine and Sacred Feminine,rehabilitation-psychology-mental-health-support-through-physical-recovery,"Chronic Illness, Pain & Medical Psychology",RETITLE,Rehabilitation Psychology Supporting Mental Health During Physical Recovery,rehabilitation-psychology-supporting-mental-health-during-physical-recovery,Therapy & Treatment,"Psychological factors strongly predict physical rehabilitation outcomes, and up to 40% of patients experience depression that directly impedes their recovery progress.",
c93380ee-4c66-46b3-8b57-d49949e0a7b0,How Trauma Affects Self-Worth,values-guide-life-practical-clarification-exercise,"Self-Worth, Confidence & Identity",RETITLE,Clarifying Values to Guide Life Decisions and Direction,clarifying-values-to-guide-life-decisions-and-direction,Self-Esteem & Identity,"Values clarification helps people identify what genuinely matters to them and use those ongoing commitments as a compass for decisions, resilience, and life satisfaction.",
c93f643f-c662-4bda-ad89-e180f5ccab4c,Therapy for LGBTQ+ People,when-friend-tells-you-theyre-struggling-respond-with-care,"Therapy, Treatment & Mental Health Navigation",RETITLE,How to Respond When a Friend Shares Mental Health Struggles,how-to-respond-when-a-friend-shares-mental-health-struggles,Relationships & Social Health,"When a friend discloses mental health struggles, your response matters enormously — learn what to say and what to avoid to provide genuine, supportive care.",
c978c9c0-e9ab-4a5e-ac06-a2a63a6f09c5,Anxiety in Older Adults,mindfulness-based-stress-reduction-what-the-evidence-shows,"Anxiety, Stress & Overwhelm",RETITLE,Mindfulness-Based Stress Reduction What the Evidence Shows,mindfulness-based-stress-reduction-what-the-evidence-shows,Therapy & Treatment,"MBSR is an evidence-based 8-week program that significantly reduces anxiety, stress, and depression through body scan, sitting meditation, and mindful movement practices.",
c9b52739-9b47-4fd8-85a9-ebae637548e5,Intergenerational Trauma,trauma-dissociation-mind-disconnects-survive,Trauma-Informed Education & Healing,RETITLE,Dissociation After Trauma How the Mind Disconnects to Survive,dissociation-after-trauma-how-the-mind-disconnects-to-survive,Trauma & PTSD,"Dissociation is the mind's emergency response to overwhelming trauma, ranging from depersonalization to amnesia, and affects 15-30% of people with PTSD.",
c9e46123-593e-4c5c-8c26-f703e1479138,Loneliness in Older Adults,loneliness-after-loss-when-grief-removes-your-person,"Loneliness, Social Connection & Belonging",RETITLE,Loneliness After Loss When Grief Removes Your Person,loneliness-after-loss-when-grief-removes-your-person,Life Transitions & Crises,Bereavement loneliness is distinct from ordinary loneliness — it is the yearning for one irreplaceable person and cannot be solved simply by building new social connections.,
ca9e7cdc-b041-4e28-a260-9b714cf081d5,Physical Exercise and Brain Health,suicide-prevention-in-older-adults-the-silent-epidemic,"Aging, Dementia & Late-Life Mental Health",RETITLE,Suicide Prevention in Older Adults a Silent Epidemic,suicide-prevention-in-older-adults-a-silent-epidemic,Life Transitions & Crises,"Suicide rates are highest among older adults yet widely underrecognized — learn the warning signs, risk factors, and intervention strategies specific to late life.",
caa46ee7-f761-4c72-bb2c-c6f5b4515ff5,Trauma and the Immune System,animal-assisted-therapy-trauma-dogs-horses-evidence,Trauma-Informed Education & Healing,RETITLE,Animal-Assisted Therapy for Trauma Recovery Dogs and Horses,animal-assisted-therapy-for-trauma-recovery-dogs-and-horses,Trauma & PTSD,"Animal-assisted therapy integrates trained animals into trauma treatment, reducing PTSD symptoms and anxiety by providing non-verbal attunement and unconditional acceptance.",
cac846a0-dfb8-4072-99fb-9300ceb2e9db,Immigration and Mental Health,mental-health-latin-american-communities,"Cultural Perspectives, Inclusion & Global Wellness",RETITLE,Mental Health in Latin American Communities Cultural Values and Care,mental-health-in-latin-american-communities-cultural-values-and-care,Global & Cultural Mental Health,"Mental health in Latino communities is shaped by familismo, faith, respeto, and cultural idioms like ataque de nervios that influence how distress is expressed and treated.",
cac9b922-cfd6-459a-958e-7ad349a36fa7,Hearing Loss and Dementia Risk,vascular-dementia-lewy-body-and-other-types,"Aging, Dementia & Late-Life Mental Health",RETITLE,"Vascular Dementia, Lewy Body, and Other Dementia Types Explained",vascular-dementia-lewy-body-and-other-types-explained,Global & Cultural Mental Health,"An overview of vascular dementia, Lewy body dementia, and other dementia subtypes, including causes, symptoms, diagnosis, and treatment differences.",
cbf8d15a-d0a0-4b00-8834-3d1a48d7aa75,The Zeigarnik Effect,employee-wellbeing-programs-what-works,"Work, Productivity & Burnout",RETITLE,What the Research Says About Employee Wellbeing Programs,employee-wellbeing-programs-what-works,Workplace & Academic,"A research-backed analysis of which workplace mental health interventions actually work, finding organizational changes outperform individual wellness programs.",
cc5c74e8-dcc0-4490-bc3c-626cb771a1cb,Grief and Physical Health,how-to-support-yourself-between-therapy-sessions,"Depression, Grief & Loss",RETITLE,How to Support Mental Health Between Therapy Sessions,how-to-support-yourself-between-therapy-sessions,Therapy & Treatment,"Practical strategies for extending therapy benefits into everyday life, including homework completion, skill practice, and self-monitoring techniques.",
cc66564d-5f71-4a10-b11f-673ed1d60d67,Preventing Burnout Systemically,pomodoro-technique-time-boxing-productivity-hacks-work,"Work, Productivity & Burnout",RETITLE,The Pomodoro Technique and Other Productivity Methods Reviewed,pomodoro-technique-and-productivity-methods-reviewed,Workplace & Academic,"An evidence-based review of popular productivity techniques including the Pomodoro method, examining what research says about their effectiveness.",
cc9a0f16-a5e9-4d75-bee0-7d695aaa501c,The Role of Environment in Habit Formation,habit-stacking-attach-new-behaviors,"Habits, Motivation & Behavior Change",RETITLE,Habit Stacking: Attaching New Behaviors to Existing Routines,habit-stacking-attaching-new-behaviors-to-existing-routines,Self-Esteem & Identity,"How habit stacking uses existing daily routines as cues for new behaviors, making lasting habit formation faster and less dependent on willpower.",
cca526c4-cea7-4cdc-aa1d-0ed28d754ad1,Suicidal Thoughts,depression-new-parents-postpartum-partners,"Depression, Grief & Loss",RETITLE,"Postpartum Depression Affects All Parents, Not Just Mothers",postpartum-depression-affects-all-parents-not-just-mothers,Depression & Mood,"Postpartum depression affects around 1 in 7 birthing parents and 1 in 10 non-birthing partners; this article covers symptoms, risk factors, and treatment for all new parents.",
ccf08bc6-55b7-4a2f-8381-ca51a26a0499,The Long Game,healthcare-navigators-the-mental-health-value-of-having-someone-guide-your-care,"Chronic Illness, Pain & Medical Psychology",RETITLE,How Healthcare Navigators Reduce the Mental Health Burden of Chronic Illness,healthcare-navigators-mental-health-burden-chronic-illness,Therapy & Treatment,"Healthcare navigators guide patients through complex medical systems, reducing the anxiety and depression linked to administrative burden in chronic illness care.",
