id,old_title,old_slug,old_category,action,new_title,new_slug,new_category,seo_description,duplicate_of
40776fac-2161-4023-934d-e8730a8481ab,People-Pleasing,rebuilding-identity-after-long-term-relationship-ends,Relationships & Communication,RETITLE,Rebuilding Identity After a Long-Term Relationship Ends,rebuilding-identity-after-a-long-term-relationship-ends,Life Transitions & Crises,How self-concept disruption occurs after a breakup and practical steps to rebuild a personal identity outside of a long-term relationship.,
40f4eec3-f85e-43cc-a73e-2ea81af0a83c,Childhood Emotional Neglect,guilt-of-choosing-care-facility,Relationships & Communication,RETITLE,Coping with Guilt After Placing a Loved One in a Care Facility,coping-with-guilt-after-placing-a-loved-one-in-a-care-facility,Life Transitions & Crises,"Nearly 80% of family members feel significant guilt when placing a loved one in a care facility, even when it is the right and necessary decision.",
41517e8e-cb13-48c7-8cad-ea0711bcba41,Subjective Cognitive Decline,depression-and-chronic-illness-in-older-adults,"Aging, Dementia & Late-Life Mental Health",RETITLE,How Depression and Chronic Illness Interact in Older Adults,how-depression-and-chronic-illness-interact-in-older-adults,Depression & Mood,Depression and chronic illness form a vicious cycle in older adults — each worsening the other — and treating both together significantly improves outcomes.,
41c05ea6-31d2-4823-b70a-a8b4f8316a42,The Inner Child,confidence-gap-act-confident,"Self-Worth, Confidence & Identity",RETITLE,The Confidence Gap: Acting Despite Self-Doubt,the-confidence-gap-acting-despite-self-doubt,Self-Esteem & Identity,"Research shows confidence follows action, not the other way around — understanding the confidence gap can break the cycle of waiting to feel ready.",
41ffe446-e9c6-4b7d-92bd-9a94bcb605b3,How Parental Conflict Affects Children,how-your-birth-order-affects-your-psychological-development,Relationships & Communication,RETITLE,What Birth Order Actually Does to Personality,what-birth-order-actually-does-to-personality,Relationships & Social Health,"Decades of research reveal birth order has smaller personality effects than pop psychology claims, though some consistent patterns do emerge.",
4255b9f7-e6ff-40d1-bee9-e947354d51bc,Generational Trauma,war-displacement-refugee-experience-family-trauma,Relationships & Communication,RETITLE,"War, Displacement, and the Psychological Toll on Refugee Families",war-displacement-and-the-psychological-toll-on-refugee-families,Trauma & PTSD,"Refugees face layered trauma before, during, and after displacement — and its effects can extend across generations into children born in new countries.",
4263de7f-b061-4027-b969-956a49e52eee,Depression and Dementia Risk,medication-management-for-late-life-depression-and-anxiety,"Aging, Dementia & Late-Life Mental Health",RETITLE,Medication Management for Depression and Anxiety in Older Adults,medication-management-for-depression-and-anxiety-in-older-adults,Therapy & Treatment,"Aging changes how the body processes medications, making careful antidepressant selection and dosing essential for safe and effective treatment in older adults.",
42fb9f25-2aab-4d63-b4f5-36363ac64f18,Fatherhood and Identity,anger-management-for-men-understanding-and-channeling-rage,Men's Mental Health,RETITLE,Anger Management for Men: Understanding and Breaking the Rage Cycle,anger-management-for-men-understanding-and-breaking-the-rage-cycle,Anxiety & Stress,"Men are socialized to externalize emotions as anger, but chronic unmanaged rage doubles cardiovascular disease risk and is changeable with the right approach.",
42fe723a-aec4-42f3-8abe-163ece656d00,Who Gets Lonely,surgeon-general-advisory-on-loneliness-what-it-says-why-it-matters,"Loneliness, Social Connection & Belonging",RETITLE,The Surgeon General's Loneliness Advisory: What It Says and Why It Matters,surgeon-generals-loneliness-advisory-what-it-says-and-why-it-matters,Relationships & Social Health,"In 2023 the U.S. Surgeon General declared loneliness a public health epidemic, citing health risks comparable to smoking up to 15 cigarettes a day.",
4340f1bd-e47b-4ef4-8784-b368152945e6,How to Maintain Long-Distance Friendships,relationship-check-ins-weekly-practice,Relationships & Communication,RETITLE,Why Couples Should Practice Regular Relationship Check-Ins,why-couples-should-practice-regular-relationship-check-ins,Relationships & Social Health,"Structured recurring check-ins help couples address small issues before they grow into resentment, boosting long-term satisfaction and connection.",
43d4b600-a134-4dd1-8ac8-0ade50064dab,Dementia Diagnosis,substance-use-and-addiction-in-later-life-the-overlooked-crisis,"Aging, Dementia & Late-Life Mental Health",RETITLE,Substance Use and Addiction in Older Adults: An Overlooked Crisis,substance-use-and-addiction-in-older-adults-an-overlooked-crisis,Substance Use & Addiction,"Alcohol and prescription drug misuse among older adults is rising and often misattributed to aging, making early recognition and treatment critical.",
43daa68c-ba85-4de7-828f-a139952f2e72,Digital Limits,boundaries-vs-walls-protect-yourself-without-shutting-people-out,Relationships & Communication,RETITLE,Boundaries vs Walls: Protecting Yourself Without Shutting People Out,boundaries-vs-walls-protecting-yourself-without-shutting-people-out,Relationships & Social Health,"Healthy boundaries allow trust and connection to grow, while emotional walls prevent all intimacy — learning the difference can transform relationships.",
44148ae6-d0c4-4230-817d-19541e692180,Recovery-Oriented Care,what-to-do-when-someone-refuses-treatment,"Therapy, Treatment & Mental Health Navigation",RETITLE,What to Do When a Loved One Refuses Mental Health Treatment,what-to-do-when-a-loved-one-refuses-mental-health-treatment,Therapy & Treatment,Understanding why people refuse treatment — from anosognosia to fear and stigma — helps caregivers navigate one of mental health's most painful situations.,
4416fb05-5d89-491c-b74c-2f6026a87093,Antipsychotics,your-first-therapy-session-what-actually-happens,"Therapy, Treatment & Mental Health Navigation",RETITLE,What Actually Happens in a First Therapy Session,what-actually-happens-in-a-first-therapy-session,Therapy & Treatment,"A step-by-step guide to what to expect in an intake therapy session, from paperwork and consent to goals and what therapists are really looking for.",
443aac80-3241-4c1a-9b97-ef72a032c176,Masculinity Across Cultures,mental-health-stigma-what-it-is-how-to-fight-it,"Cultural Perspectives, Inclusion & Global Wellness",RETITLE,Mental Health Stigma: What It Is and How to Fight It,mental-health-stigma-what-it-is-and-how-to-fight-it,Global & Cultural Mental Health,Stigma stops two-thirds of people with mental illness from seeking help — understanding its forms and origins is the first step to dismantling it.,
448fb0a6-4b1e-4564-bb5c-234a8c1eb79b,Body Dysmorphic Disorder,acute-stress-disorder,Understanding Mental Health Conditions,RETITLE,Acute Stress Disorder: Early Trauma Response and Prevention,acute-stress-disorder-early-trauma-response-and-prevention,Trauma & PTSD,Acute stress disorder develops within days of trauma and predicts PTSD risk — early CBT can reduce that risk by 50-60% in the critical first month.,
44ab1ca1-f8e3-455c-87b7-1d7a2e7ace60,Diagnosis,panic-disorder-understanding-recurrent-panic-attacks,Understanding Mental Health Conditions,RETITLE,Understanding Panic Disorder and Recurrent Panic Attacks,understanding-panic-disorder-and-recurrent-panic-attacks,Anxiety & Stress,"Panic disorder involves unexpected, recurrent panic attacks followed by persistent worry about future attacks, creating a cycle of fear and avoidance.",
44d727fb-89d0-486d-b5cf-8f1c8c97eb4f,The Psychology of Ceremony,clinical-health-psychology-what-it-is-and-how-it-helps-medical-patients,"Chronic Illness, Pain & Medical Psychology",RETITLE,Clinical Health Psychology: How It Helps Medical Patients,clinical-health-psychology-how-it-helps-medical-patients,Therapy & Treatment,"Clinical health psychologists work inside medical teams to improve treatment adherence, surgical recovery, and quality of life across major medical conditions.",
452b449f-37d4-41bb-bd37-ff8b9dba8558,Hypervigilance,complex-trauma-vs-single-incident-why-distinction-matters,Trauma-Informed Education & Healing,RETITLE,Complex Trauma vs Single-Incident Trauma: Why the Distinction Matters,complex-trauma-vs-single-incident-trauma-why-the-distinction-matters,Trauma & PTSD,"Complex trauma from prolonged childhood adversity differs fundamentally from single-incident trauma, requiring different treatment approaches for recovery.",
45757109-d4d5-483a-b828-5d48b201ff55,The Fear of Rejection,loneliness-in-20s-30s-when-adult-friendships-get-hard,"Loneliness, Social Connection & Belonging",RETITLE,Why Friendships Get Harder in Your 20s and 30s,why-friendships-get-harder-in-your-20s-and-30s,Relationships & Social Health,The narrowing of social networks in early adulthood is a predictable developmental shift driven by structural changes in how people spend their time and where they live.,
4599a118-7ac5-40cd-bf06-63c42fc96252,Relationship Anxiety,social-media-and-social-anxiety-how-digital-comparison-fuels-fear,"Anxiety, Stress & Overwhelm",RETITLE,How Social Media Amplifies Social Anxiety and Fear of Judgment,how-social-media-amplifies-social-anxiety-and-fear-of-judgment,Anxiety & Stress,"Social media offers easier interaction but worsens social anxiety through constant comparison, fear of negative evaluation, and avoidance of real-world socializing.",
45bf9b43-99d6-4edc-9306-4c0d881589b8,Parenting a Child With ADHD,the-inner-child-understanding-the-past-versions-of-yourself,Relationships & Communication,RETITLE,The Inner Child: Understanding and Healing Past Emotional Wounds,the-inner-child-understanding-and-healing-past-emotional-wounds,Self-Esteem & Identity,"The inner child represents unmet childhood needs and unprocessed hurts that shape adult emotional reactions, and can be healed through therapy and self-compassion.",
463553b8-2a8e-482f-b2a5-39eecd08c2f4,Somatic Expressions of Distress,indigenous-mental-health,"Cultural Perspectives, Inclusion & Global Wellness",RETITLE,Indigenous Mental Health: Healing Traditions and Historical Trauma,indigenous-mental-health-healing-traditions-and-historical-trauma,Global & Cultural Mental Health,Indigenous communities worldwide face mental health disparities rooted in colonization while holding ancient healing traditions increasingly recognized by Western medicine.,
46642e86-697d-43c8-abf8-2b9fc687972c,Gender Identity and Mental Health,dunning-kruger-effect-vs-imposter-syndrome-self-assessment,"Self-Worth, Confidence & Identity",RETITLE,Dunning-Kruger Effect vs Imposter Syndrome: Opposite Failures of Self-Assessment,dunning-kruger-effect-vs-imposter-syndrome-opposite-failures-of-self-assessment,Self-Esteem & Identity,Novices overestimate their ability while experts underestimate theirs — understanding these mirror-image distortions reveals how to assess oneself more accurately.,
46c83531-2fdd-4673-9479-b32fedd5b14e,Fibromyalgia,intermittent-explosive-disorder,Understanding Mental Health Conditions,RETITLE,Intermittent Explosive Disorder: Understanding Disproportionate Anger Outbursts,intermittent-explosive-disorder-understanding-disproportionate-anger-outbursts,Anxiety & Stress,"Intermittent explosive disorder involves recurrent anger outbursts grossly disproportionate to triggers and affects 3-5% of the population, but responds well to CBT.",
47077218-c396-4715-af36-5e3d867c2b97,How to Talk to a Partner About Your Anxiety,claustrophobia-understanding-the-fear-of-enclosed-spaces,"Anxiety, Stress & Overwhelm",RETITLE,Claustrophobia: Understanding the Fear of Enclosed Spaces,claustrophobia-understanding-the-fear-of-enclosed-spaces,Anxiety & Stress,Claustrophobia affects 4–7% of people and triggers intense panic in enclosed spaces — learn what causes it and how to manage the fear of confinement.,
4780e93c-6936-47fd-afcc-d936477fc542,The Psychology of Legacy,only-children-psychology,Relationships & Communication,RETITLE,Only Children: What Research Actually Says About Stereotypes,only-children-what-research-says-about-stereotypes,Relationships & Social Health,Decades of research contradict popular myths about only children being spoiled or socially awkward — here is what studies actually show about their development.,
47c7529f-9d6c-475a-8e36-6880592be0d1,Depression in Different Cultures,psychotherapy-vs-medication-combining-both,"Depression, Grief & Loss",RETITLE,Therapy vs Medication for Depression: What Research Shows,therapy-vs-medication-for-depression-what-research-shows,Therapy & Treatment,Research shows combined therapy and medication outperforms either treatment alone for depression — learn which approach fits different severity levels.,
47e9e229-cc7b-4619-aa1f-ab728c861d9d,Viktor Frankl and Logotherapy,identity-after-diagnosis-who-are-you-when-your-body-changes,"Chronic Illness, Pain & Medical Psychology",RETITLE,How Chronic Illness Disrupts Identity and Sense of Self,how-chronic-illness-disrupts-identity-and-sense-of-self,Life Transitions & Crises,Identity disruption is one of the strongest predictors of distress in chronic illness — often more powerful than disease severity itself.,
47fdfae8-282b-42f9-9a8c-fc4d20380125,Perimenopause and Mental Health,men-and-custody-battles-the-psychological-toll-of-legal-conflict,Men's Mental Health,RETITLE,The Psychological Toll of Custody Battles on Fathers,psychological-toll-of-custody-battles-on-fathers,Life Transitions & Crises,"Custody disputes create compounded psychological trauma for fathers — combining grief, identity threat, financial strain, and powerlessness simultaneously.",
48420b0a-038a-42df-8360-77df01e7c71d,Gender-Affirming Care,men-pain-and-stoicism-why-ignoring-physical-symptoms-is-a-mental-health-problem,Men's Mental Health,RETITLE,Male Stoicism and Physical Health: Why Ignoring Pain Is Dangerous,male-stoicism-and-physical-health-why-ignoring-pain-is-dangerous,Self-Esteem & Identity,"Men delay seeking medical care far longer than women due to cultural conditioning around pain and toughness, contributing significantly to the gender life-expectancy gap.",
484b1f21-533c-4f6f-95dd-a81749c985c6,Online Therapy,antipsychotic-medications-what-they-treat-how-they-work,"Therapy, Treatment & Mental Health Navigation",RETITLE,Antipsychotic Medications: What They Treat and How They Work,antipsychotic-medications-what-they-treat-and-how-they-work,Therapy & Treatment,"Antipsychotic medications treat schizophrenia, bipolar disorder, and severe depression — learn the difference between first- and second-generation options.",
487919df-8b5c-4cc0-899d-c29aeff3614c,When Depression Lifts,anniversary-reactions-dates-trigger-emotional-waves,"Depression, Grief & Loss",RETITLE,Anniversary Reactions: When Dates Trigger Waves of Grief,anniversary-reactions-when-dates-trigger-waves-of-grief,Depression & Mood,Anniversary reactions are emotional surges tied to calendar dates of past losses or trauma — understanding why they happen can help you navigate them with compassion.,
487f0b6e-091c-4546-b873-4275d9b8cc33,Imposter Syndrome,anxious-attachment-when-fear-of-abandonment-drives-your-behavior,"Anxiety, Stress & Overwhelm",RETITLE,Anxious Attachment: How Fear of Abandonment Shapes Relationships,anxious-attachment-how-fear-of-abandonment-shapes-relationships,Relationships & Social Health,"Anxious attachment — rooted in inconsistent early caregiving — creates hypervigilance and intense reassurance-seeking in adult relationships, but it can be changed.",
48902c52-1099-48e0-9bf9-6736f7652256,Commitment Devices,build-exercise-routine-hate-working-out,"Habits, Motivation & Behavior Change",RETITLE,How to Build a Movement Routine When Exercise Feels Awful,how-to-build-a-movement-routine-when-exercise-feels-awful,Anxiety & Stress,Even 15 minutes of daily movement reduces depression risk by 26% — this guide helps people who hate exercise find movement they can actually sustain.,
490ad6b0-8691-4bdd-8f69-7005441fa9bc,Gender and Healthcare,myth-depression-in-men-is-just-laziness-or-lack-of-motivation,Men's Mental Health,RETITLE,Why Depression in Men Is Mistaken for Laziness,why-depression-in-men-is-mistaken-for-laziness,Depression & Mood,"When depression in men presents as withdrawal and low energy rather than sadness, it is often misread as laziness — a dangerous misreading that delays treatment.",
499eac14-bbdd-471e-ab39-bfbfd6f90f33,The Role of Routine in Recovery,depression-lgbtq-community-minority-stress,"Depression, Grief & Loss",RETITLE,Depression in LGBTQ+ Communities and the Minority Stress Model,depression-in-lgbtq-communities-and-the-minority-stress-model,Depression & Mood,"LGBTQ+ individuals experience depression at two to three times the rate of peers — driven not by identity but by chronic discrimination, stigma, and social rejection.",
49a4c0aa-bea2-4193-b869-04fa71b89ff3,Identity After Job Loss,fawn-response-trauma-creates-people-pleasers,"Self-Worth, Confidence & Identity",RETITLE,The Fawn Trauma Response: When Appeasement Becomes Survival,the-fawn-trauma-response-when-appeasement-becomes-survival,Trauma & PTSD,The fawn response is a fourth trauma response — appeasing others to avoid harm — most common in those who experienced childhood trauma from caregivers.,
4a0ceeff-aeca-465f-944f-d614147f05a1,Compassion Fatigue in Helpers,self-compassion-when-your-body-lets-you-down,"Chronic Illness, Pain & Medical Psychology",RETITLE,Practicing Self-Compassion When Chronic Illness Limits What Is Possible,practicing-self-compassion-when-chronic-illness-limits-what-is-possible,Life Transitions & Crises,Self-criticism raises cortisol and inflammation in chronic illness — research shows self-compassion produces measurably better outcomes across virtually every chronic condition.,
4a0d38a0-88f7-42b8-9644-96c86a04c0e5,Grief Across Cultures,microaggressions-mental-health-cumulative-toll-everyday-racism,"Cultural Perspectives, Inclusion & Global Wellness",RETITLE,Racial Microaggressions and Their Cumulative Toll on Mental Health,racial-microaggressions-and-their-cumulative-toll-on-mental-health,Global & Cultural Mental Health,Everyday racial microaggressions accumulate into chronic stress that damages mental health in measurable ways — even when each incident seems minor in isolation.,
4a4de482-4063-460e-a991-e066626f5c02,The Psychology of Productivity,psychological-contract-work-expectations,"Work, Productivity & Burnout",RETITLE,The Psychological Contract: Unwritten Workplace Expectations That Shape Well-Being,psychological-contract-unwritten-workplace-expectations,Workplace & Academic,The psychological contract — the unwritten agreement between employee and employer — has a stronger impact on job satisfaction and mental health than formal job terms.,
4ad8edaf-3f0e-4654-8ea6-4f968c5dc760,Trolling and Online Harassment,misinformation-mental-health-false-claims-real-harm,"Digital Life, Social Media & Modern Stressors",RETITLE,How Misinformation Harms Mental Health in the Digital Age,how-misinformation-harms-mental-health-in-the-digital-age,Anxiety & Stress,"Exposure to misinformation causes measurable psychological harm — increasing anxiety, eroding trust, and making health decisions harder for millions of people.",
4b0163f6-9df7-49e3-a3a0-fbb043df3d6a,Compassion,icu-delirium-and-post-icu-ptsd-the-hidden-epidemic,"Chronic Illness, Pain & Medical Psychology",RETITLE,ICU Delirium and Post-ICU PTSD: The Hidden Epidemic,icu-delirium-and-post-icu-ptsd-the-hidden-epidemic,Trauma & PTSD,"Up to 80% of ventilated ICU patients develop delirium, and one in four survivors develops PTSD — a condition now formally recognized as post-intensive care syndrome.",
4b58254a-1294-4425-9bdf-2fedd4d201a5,The Psychology of Hope,acceptance-and-commitment-therapy-for-chronic-pain,"Chronic Illness, Pain & Medical Psychology",RETITLE,Acceptance and Commitment Therapy for Chronic Pain,acceptance-and-commitment-therapy-for-chronic-pain,Therapy & Treatment,"ACT therapy asks whether a meaningful life requires the absence of pain — and research shows it reduces pain interference, disability, and distress in chronic pain patients.",
4b62a35a-4e90-4fd2-ab39-cb86588d74c7,Trauma-Informed Care,complex-ptsd-dsm-catching-up,Trauma-Informed Education & Healing,RETITLE,"Complex PTSD: History, Diagnosis, and Why the DSM Lags Behind",complex-ptsd-history-diagnosis-and-why-the-dsm-lags-behind,Trauma & PTSD,Complex PTSD was recognized by the ICD-11 in 2018 but still lacks a DSM-5 diagnosis — leaving many survivors misdiagnosed with BPD or treatment-resistant depression.,
4baae56b-dff9-4e39-93a0-03f6692e79fd,Loss of Identity,behavioral-activation-evidence-based-self-help-strategy-depression,"Depression, Grief & Loss",RETITLE,Behavioral Activation: An Evidence-Based Strategy for Depression,behavioral-activation-evidence-based-strategy-for-depression,Depression & Mood,Behavioral activation breaks the depression-withdrawal cycle by building action before motivation arrives — one of the most effective and researched strategies available.,
4bf4ca55-11c2-4766-9ff1-3d745151bb3b,Performance Anxiety,the-inner-critic-in-social-anxiety-why-you-assume-the-worst,"Anxiety, Stress & Overwhelm",RETITLE,The Inner Critic in Social Anxiety: Why Worst-Case Thinking Persists,the-inner-critic-in-social-anxiety-why-worst-case-thinking-persists,Anxiety & Stress,"In social anxiety, an inner critic narrates every interaction with worst-case assumptions — and research shows people with social anxiety are far harsher self-judges than others perceive them.",
4c261780-31c0-41b8-b360-bfee3334d713,The Critic in Your Head,self-esteem-spectrum-fragile-contingent-stable,"Self-Worth, Confidence & Identity",RETITLE,"The Self-Esteem Spectrum: Fragile, Contingent, and Stable",the-self-esteem-spectrum-fragile-contingent-and-stable,Self-Esteem & Identity,Self-esteem is not simply high or low — research reveals that stability and contingency matter just as much as level in predicting mental health outcomes.,
4ce0fde6-1d01-494a-a3cd-312714670b69,Trauma and Creativity,supporting-partner-ptsd-what-helps-what-doesnt,Trauma-Informed Education & Healing,RETITLE,Supporting a Partner With PTSD: What Helps and What Backfires,supporting-a-partner-with-ptsd-what-helps-and-what-backfires,Trauma & PTSD,Partners play a crucial role in PTSD recovery — but uninformed support can reinforce avoidance and lead to burnout; here is what research says actually helps.,
4cee20c0-b440-43ba-9fe7-41adb2e56039,The Psychology of Ritual,heart-disease-and-anxiety-the-cardiac-mental-health-connection,"Chronic Illness, Pain & Medical Psychology",RETITLE,Heart Disease and Anxiety: Understanding the Cardiac Mental Health Connection,heart-disease-and-anxiety-the-cardiac-mental-health-connection,Anxiety & Stress,Anxiety is an independent risk factor for cardiovascular disease — raising coronary heart disease risk by 26% — and the two conditions worsen each other when they coexist.,
4d4a670b-81f6-44b0-b60f-5f93a0c6dbe5,Jealousy,how-to-heal-after-breakup-evidence-based-strategies,Relationships & Communication,RETITLE,Evidence-Based Strategies for Healing After a Breakup,evidence-based-strategies-for-healing-after-a-breakup,Relationships & Social Health,"Science-backed strategies for recovering from a breakup, including no-contact approaches and why they accelerate emotional healing.",
4d4c1e0f-1e32-4cb1-86e8-ca8717462318,The Art of Asking for What You Need,avoidant-attachment-when-closeness-feels-like-a-threat,Relationships & Communication,RETITLE,Avoidant Attachment and Why Closeness Feels Threatening,avoidant-attachment-and-why-closeness-feels-threatening,Relationships & Social Health,"An in-depth look at avoidant attachment style, its origins in early caregiving, and the deactivating strategies that keep intimacy at a distance.",
4da0d947-3941-4c7e-875f-9580b6a3f2b5,Meeting Anxiety,workplace-anxiety-managing-fear-in-meetings-emails-and-deadlines,"Anxiety, Stress & Overwhelm",RETITLE,"Managing Workplace Anxiety Across Meetings, Emails, and Deadlines",managing-workplace-anxiety-across-meetings-emails-and-deadlines,Workplace & Academic,"Practical, evidence-based strategies for reducing anxiety in professional settings, from presentations to high-stakes deadlines.",
4dba5b73-90d1-4c28-8725-634d906a49c5,Disability and Culture,celebrity-mental-health-disclosure,"Cultural Perspectives, Inclusion & Global Wellness",RETITLE,How Celebrity Mental Health Disclosure Shapes Public Attitudes,how-celebrity-mental-health-disclosure-shapes-public-attitudes,Global & Cultural Mental Health,"Research on how high-profile mental health disclosures by celebrities can reduce stigma, increase help-seeking, and sometimes cause harm.",
4dc5c26e-da64-46f9-9b61-abecd21403c0,Late Life Anxiety,cultural-considerations-in-elder-care-family-expectations,"Aging, Dementia & Late-Life Mental Health",RETITLE,Cultural Expectations Around Elder Care and Family Caregiving,cultural-expectations-around-elder-care-and-family-caregiving,Global & Cultural Mental Health,"How cultural norms around filial piety and family loyalty shape elder care decisions, and how caregivers can navigate tradition and modern reality.",
4e741673-201f-403a-88f4-82cfa4bf4817,Music and Dementia,grief-and-bereavement-in-older-adults-when-loss-is-cumulative,"Aging, Dementia & Late-Life Mental Health",RETITLE,Grief and Cumulative Loss in Older Adults,grief-and-cumulative-loss-in-older-adults,Life Transitions & Crises,How older adults face bereavement overload from multiple simultaneous losses and what makes grief unique in later life.,
